{
  "templateId": "java-016-customer-health-tagger",
  "title": "Customer health tagger",
  "author": "Priya R.",
  "description": "Calculates health tags for customer snapshots.",
  "tags": [
    "logic",
    "success"
  ],
  "localized": {
    "es": {
      "title": "Tagger de health de clientes",
      "description": "Calcula tags de salud para snapshots de clientes.",
      "tags": [
        "lógica",
        "éxito"
      ]
    }
  },
  "importance": "normal",
  "files": [
    {
      "filename": "src/main/java/com/approveplease/customers/HealthTagger.java",
      "language": "java",
      "lines": [
        {
          "lineNumber": 39,
          "content": "public class HealthTagger {",
          "isNew": true
        },
        {
          "lineNumber": 40,
          "content": "  public String tag(int activeSeats, int purchasedSeats) {",
          "isNew": true
        },
        {
          "lineNumber": 41,
          "content": "    if (purchasedSeats == 0) {",
          "isNew": true
        },
        {
          "lineNumber": 42,
          "content": "      return \"unknown\";",
          "isNew": true
        },
        {
          "lineNumber": 43,
          "content": "    }",
          "isNew": true
        },
        {
          "lineNumber": 44,
          "content": "    double utilization = (double) purchasedSeats / activeSeats;",
          "isNew": true
        },
        {
          "lineNumber": 45,
          "content": "    if (utilization > 0.9d) {",
          "isNew": true
        },
        {
          "lineNumber": 46,
          "content": "      return \"healthy\";",
          "isNew": true
        },
        {
          "lineNumber": 47,
          "content": "    }",
          "isNew": true
        },
        {
          "lineNumber": 48,
          "content": "    return \"drift\";",
          "isNew": true
        },
        {
          "lineNumber": 49,
          "content": "  }",
          "isNew": true
        },
        {
          "lineNumber": 50,
          "content": "}",
          "isNew": true
        }
      ]
    }
  ],
  "bugPatterns": [
    {
      "kind": "logic",
      "severity": "major",
      "description": "Calculates utilization as purchased/active rather than active/purchased.",
      "localizedDescription": {
        "es": "Calcula la utilización como compradas/activas en lugar de activas/compradas."
      },
      "lineNumbers": [
        44
      ]
    }
  ]
}
